{
  "input_id": "i-92bd-1",
  "provenance": {
    "collected_at": "2026-10-10T12:00:00Z",
    "source_id": "s-92bd",
    "source_kind": "synthetic"
  },
  "schema_version": "proofkey-decision-input-v1",
  "snapshot": {
    "analysis_status": "pending_not_started",
    "authorization": "unverified",
    "case_id": "c-92bd",
    "events": [
      {
        "channel": "chat",
        "event_id": "e-92bd-1",
        "kind": "message",
        "media": null,
        "occurred_at": "2026-10-10T11:01:00Z",
        "recipient_ids": [
          "p-92bd-1"
        ],
        "sender_id": "p-92bd-0",
        "text": "I refused the parcel for this order because the outer carton looked crushed. I have not sent any photos. I want a refund."
      }
    ],
    "language": "en",
    "links": {
      "customer_id": "p-92bd-0",
      "operator_id": "p-92bd-1",
      "order_id": "o-92bd"
    },
    "needs_analysis": true,
    "operational_effects": 0,
    "participants": [
      "p-92bd-0",
      "p-92bd-1",
      "p-92bd-2"
    ],
    "previous_snapshot_hash": "ed234fe7cccd8406b6a44c6400604781c024db01469524679cacd1994f311623",
    "revision": 1,
    "runtime_binding": null,
    "schema_version": "dwelly-local-case-v1",
    "snapshot_hash": "c116f57fb24d593aca32f7db814deff4be9a287e961edb00887b9a3a659fdb34",
    "source_mode": "local_fixture"
  },
  "source": {
    "case_id": "c-92bd",
    "revision": 1,
    "snapshot_hash": "c116f57fb24d593aca32f7db814deff4be9a287e961edb00887b9a3a659fdb34"
  },
  "visibility": "model_visible"
}
